Post ID,Network,Published time (America/Toronto),Post Type,Placement,Post text,Post URL,Impressions,Reach,Engagement rate avg.,Shares,Share Ratio,Engagements,French?,Label 1,Label 2,Label 3,Label 4,Label 5,Label 6,Label 7,Label 8,Label 9,Label 10,Label 11,Label 12,Label 13,Label 14,Label 15,Label 16,Label 17,Label 18,Label 19
146775140426_1072975321527088,FACEBOOK,2025-03-24 12:11:39,TEXT,Timeline,Quel est ce produit? 🟡 🔴 Indice: Ça complète n’importe quel sandwich,https://www.facebook.com/713040447520579/posts/1072975321527088,52607,52574,0.25%,0,0.00%,133,FR,,,,,,,,,,,,,,,,,,,
17989052750795629,INSTAGRAM,2025-03-24 11:51:49,CAROUSEL,Timeline,Le Quart de livre sauce jalapeño au fromage avec bacon a tout pour plaire.,https://www.instagram.com/p/DHlniNlsIHc/,4966,2807,1.37%,9,13.24%,68,FR,,,,,,,,,,,,,,,Cheesy Jalapeno QP,,,,
7484326576256060678,TIKTOK,2025-03-21 14:09:41,VIDEO,Timeline,the Cheesy Jalapeño & Bacon Quarter Pounder. we’re talking about the same thing right? #McDonalds #McDs #McdonaldsCanada #Food #Fyp ,https://www.tiktok.com/@mcdonaldscanada/video/7484326576256060678?utm_campaign=tt4d_open_api&utm_source=7055758955263295490,20886,15934,1.51%,16,5.06%,316,,,,,,,,,,,,,,,,Cheesy Jalapeno QP,,,,
7484308224632540422,TIKTOK,2025-03-21 12:58:28,VIDEO,Timeline,Le Quart de livre sauce jalapeño au fromage avec bacon a tout pour plaire. #McDo #tiktokquebec #pourtoi #qc ,https://www.tiktok.com/@mcdocanada/video/7484308224632540422?utm_campaign=tt4d_open_api&utm_source=7055758955263295490,1343,1044,4.99%,12,17.91%,67,FR,,,,,,,,,,,,,,,Cheesy Jalapeno QP,,,,
146775140426_1070397551784865,FACEBOOK,2025-03-21 12:35:27,IMAGE,Timeline,Le Quart de livre sauce jalapeño au fromage avec bacon a tout pour plaire.,https://www.facebook.com/713040447520579/posts/1070397551784865,20497,18187,0.37%,4,5.26%,76,FR,,,,,,,,,,,,,,,Cheesy Jalapeno QP,,,,
146775140426_1070363951788225,FACEBOOK,2025-03-21 11:52:14,IMAGE,Timeline,the Cheesy Jalapeño & Bacon Quarter Pounder. we’re talking about the same thing right?,https://www.facebook.com/713040447520579/posts/1070363951788225,28021,26579,0.39%,4,3.64%,110,,,,,,,,,,,,,,,,Cheesy Jalapeno QP,,,,
18028281587341443,INSTAGRAM,2025-03-21 11:42:46,CAROUSEL,Timeline,the Cheesy Jalapeño & Bacon Quarter Pounder. we’re talking about the same thing right?,https://www.instagram.com/p/DHd4HYEObnk/,53437,28596,1.36%,156,21.43%,728,,,,,,,,,,,,,,,,Cheesy Jalapeno QP,,,,
7483981665933544759,TIKTOK,2025-03-20 15:51:14,VIDEO,Timeline,"it’s like snack time, adult version #McDs #McDonalds #Fyp #Trend ",https://www.tiktok.com/@mcdonaldscanada/video/7483981665933544759?utm_campaign=tt4d_open_api&utm_source=7055758955263295490,15390,12210,2.06%,16,5.05%,317,,,,,,,,,,,,,,,,,,,,
146775140426_1069282478563039,FACEBOOK,2025-03-20 09:19:55,IMAGE,Timeline,"Bientôt dans un McDo près de chez toi, la boîte du film Minecraft.",https://www.facebook.com/713040447520579/posts/1069282478563039,341800,335044,0.25%,99,11.53%,859,FR,,,,,,,,,,,,Minecraft,,,,,,,
1902709808127525156,TWITTER,2025-03-20 09:12:23,IMAGE,Timeline,"Bientôt dans un McDo près de chez toi, la boîte du film Minecraft. https://t.co/AUMxyUIVSf",https://twitter.com/McDoCanada/status/1902709808127525156,1043,-,0.29%,0,0.00%,3,FR,,,,,,,,,,,,Minecraft,,,,,,,
18062191747991180,INSTAGRAM,2025-03-20 09:09:35,CAROUSEL,Timeline,"Bientôt dans un McDo près de chez toi, la boîte du film Minecraft.",https://www.instagram.com/p/DHbByiQMpAf/,14839,9418,7.33%,296,27.23%,1087,FR,,,,,,,,,,,,Minecraft,,,,,,,
1902706999000805457,TWITTER,2025-03-20 09:01:13,IMAGE,Timeline,coming soon to a McD’s near u @aMinecraftMovie Meal https://t.co/DKGSC1ifde,https://twitter.com/McDonaldsCanada/status/1902706999000805457,156437,-,3.54%,330,5.96%,5540,,,,,,,,,,,,,Minecraft,,,,,,,
146775140426_1069266888564598,FACEBOOK,2025-03-20 09:00:31,IMAGE,Timeline,coming soon to a McD’s near u @A Minecraft Movie  Meal,https://www.facebook.com/713040447520579/posts/1069266888564598,107872,101980,0.40%,54,12.41%,435,,,,,,,,,,,,,Minecraft,,,,,,,
18498578152043549,INSTAGRAM,2025-03-20 09:00:00,CAROUSEL,Timeline,coming soon to a McD’s near u  @AMinecraftMovie Meal,https://www.instagram.com/p/DHbAviXuIKh/,143826,83519,7.53%,5663,52.27%,10835,,,,,,,,,,,,,Minecraft,,,,,,,
146775140426_1069266305231323,FACEBOOK,2025-03-20 08:59:40,IMAGE,Timeline,-,https://www.facebook.com/photo.php?fbid=1069266305231323&set=a.702484221909535&type=3,12239,12239,0.83%,3,2.97%,101,,,,,,,,,,,,,,,,,,,,
7483586576895806725,TIKTOK,2025-03-19 14:18:05,VIDEO,Timeline,everybody’s talking about how u haven’t tried McSpicy yet and it’s not here for long… 👀 #McDonalds #McDs #McdonaldsCanada #McSpicy #Food #Trend ,https://www.tiktok.com/@mcdonaldscanada/video/7483586576895806725?utm_campaign=tt4d_open_api&utm_source=7055758955263295490,11306,9431,1.24%,9,6.43%,140,,,,,,,,,,,,,,,,,,,,
146775140426_1068314145326539,FACEBOOK,2025-03-19 09:07:13,IMAGE,Timeline,"Chargement le 01.04…  © 2025, WBEI et Legendary",https://www.facebook.com/713040447520579/posts/1068314145326539,42639,39949,0.38%,17,10.49%,162,FR,,,,,,,,,,,,Minecraft,,,,,,,
18038677682211413,INSTAGRAM,2025-03-19 09:05:21,CAROUSEL,Timeline,"Chargement le 01.04…  © 2025, WBEI et Legendary",https://www.instagram.com/p/DHYcglCseec/,10658,6326,3.57%,71,18.64%,381,FR,,,,,,,,,,,,Minecraft,,,,,,,
1902345177601036397,TWITTER,2025-03-19 09:03:28,IMAGE,Timeline,"Chargement le 01.04…  © 2025, WBEI et Legendary https://t.co/Q1ucII0GTc",https://twitter.com/McDoCanada/status/1902345177601036397,301,-,0.66%,0,0.00%,2,FR,,,,,,,,,,,,Minecraft,,,,,,,
1902345090494034335,TWITTER,2025-03-19 09:03:08,IMAGE,Timeline,generating on 4/1…  © 2025 WBEI and Legendary https://t.co/uvTesge13Q,https://twitter.com/McDonaldsCanada/status/1902345090494034335,18783,-,1.24%,32,13.73%,233,,,,,,,,,,,,,Minecraft,,,,,,,
18061031630060518,INSTAGRAM,2025-03-19 09:02:57,CAROUSEL,Timeline,generating on 4/1…,https://www.instagram.com/p/DHYcPDpOPLI/,103808,57589,3.42%,1211,34.07%,3554,,,,,,,,,,,,,Minecraft,,,,,,,
146775140426_1068310598660227,FACEBOOK,2025-03-19 09:01:54,IMAGE,Timeline,generating on 4/1…  © 2025 WBEI and Legendary,https://www.facebook.com/713040447520579/posts/1068310598660227,89415,87447,0.40%,36,10.14%,355,,,,,,,,,,,,,Minecraft,,,,,,,
146775140426_1067564242068196,FACEBOOK,2025-03-18 10:16:14,IMAGE,Timeline,C’est l’effet des œufs de catégorie A du Canada fraîchement cassés,https://www.facebook.com/713040447520579/posts/1067564242068196,32939,31079,0.31%,13,12.87%,101,FR,,,,,,,,,,,,,,,,,,,
18007670996717682,INSTAGRAM,2025-03-18 10:05:28,IMAGE,Timeline,C’est l’effet des œufs de catégorie A du Canada fraîchement cassés,https://www.instagram.com/p/DHV-mHzptDq/,6499,4664,2.83%,32,17.39%,184,FR,,,,,,,,,,,,,,,,,,,
18073753486771596,INSTAGRAM,2025-03-18 09:44:46,IMAGE,Timeline,freshly cracked Canada Grade A eggs will do that,https://www.instagram.com/p/DHV8Og6vE8Z/,51507,33106,1.89%,265,27.29%,971,,,,,,,,,,,,,,,,,,,,
7482852346360286470,TIKTOK,2025-03-17 14:48:54,VIDEO,Timeline,"patiently waiting for him to ask, he has 4 days. #McDonalds #McDs #McdonaldsCanada #Fyp #Trending #WhenHeStill",https://www.tiktok.com/@mcdonaldscanada/video/7482852346360286470?utm_campaign=tt4d_open_api&utm_source=7055758955263295490,10968,8968,4.25%,102,21.89%,466,,,,,,,,,,,,,,,,,,,,
18392565394105905,INSTAGRAM,2025-03-17 11:10:33,REELS,REELS,everybody’s talking about how u haven’t tried McSpicy yet and it’s not here for long… 👀,https://www.instagram.com/reel/DHThM5tutpd/,28641,23659,1.23%,33,9.35%,353,,,,,,,,,,,,,,,,,,,,
7481734250325200183,TIKTOK,2025-03-14 14:30:09,VIDEO,Timeline,"when he said crawling back to u, this is the u he meant #McDonalds #McDs #McdonaldsCanada #Fyp #Trending #Trend ",https://www.tiktok.com/@mcdonaldscanada/video/7481734250325200183?utm_campaign=tt4d_open_api&utm_source=7055758955263295490,8213,6902,1.53%,3,2.38%,126,,,,,,,,,,,,,,,,,,,,
146775140426_1064323429058944,FACEBOOK,2025-03-14 12:01:54,TEXT,Timeline,Est-ce que je suis le seul qui transforme son trio en quatuor en ajoutant un Junior au poulet?,https://www.facebook.com/713040447520579/posts/1064323429058944,17677,16733,0.24%,0,0.00%,43,FR,,,,,,,,,,,,,,,,,,,
18039643085417038,INSTAGRAM,2025-03-14 10:51:29,IMAGE,Timeline,patiently waiting for him to ask,https://www.instagram.com/p/DHLwrmFuzSU/,2284220,1842073,9.19%,106568,50.75%,210003,,,,,,,,,,,,,,,,,,,,
7481329089601621253,TIKTOK,2025-03-13 12:17:53,VIDEO,Timeline,"trying the neo-Pop-itan hack, purely because the name writes itself #McDonalds #McDs #McdonaldsCanada #Fyp #Food ",https://www.tiktok.com/@mcdonaldscanada/video/7481329089601621253?utm_campaign=tt4d_open_api&utm_source=7055758955263295490,8634,7428,1.56%,9,6.67%,135,,,,,,,,,,,,,,,,,,,,
18307708450230372,INSTAGRAM,2025-03-13 12:13:35,REELS,REELS,"trying the neo-Pop-itan hack, purely because the name writes itself",https://www.instagram.com/reel/DHJVKnVunJR/,50589,32176,0.93%,85,18.05%,471,,,,,,,,,,,,,,,,,,,,
146775140426_1063337572490863,FACEBOOK,2025-03-13 12:01:38,IMAGE,Timeline,J’ai juste une chose à te dire si tu penses que t’aurais pas l’air de 🥵… Essaye-le donc stp!,https://www.facebook.com/713040447520579/posts/1063337572490863,15782,14712,0.18%,1,3.45%,29,FR,,,,,,,,,,,,,,,,,,,
17996437928770983,INSTAGRAM,2025-03-13 12:00:55,IMAGE,Timeline,J’ai juste une chose à te dire si tu penses que t’aurais pas l’air de 🥵… Essaye-le donc stp!,https://www.instagram.com/p/DHJT1RvMme6/,3933,2788,2.29%,3,3.33%,90,FR,,,,,,,,,,,,,,,,,,,
7481003198203825413,TIKTOK,2025-03-12 15:13:15,VIDEO,Timeline,"Alors, quel McPops es-tu ? Dis-le moi en commentaire avec un 🌙 ou ☀️ #McDo #McPops #tiktokquebec #pourtoi #sunandmoon ",https://www.tiktok.com/@mcdocanada/video/7481003198203825413?utm_campaign=tt4d_open_api&utm_source=7055758955263295490,1206,960,3.32%,0,0.00%,40,FR,,,,,,,,,,,,,,,,,,,
18026315636389481,INSTAGRAM,2025-03-12 14:51:10,CAROUSEL,Timeline,"Alors, quel McPops es-tu ? Dis-le moi en commentaire avec un 🌙 ou ☀️",https://www.instagram.com/p/DHHChUPyD0n/,5202,3182,1.90%,4,4.04%,99,FR,,,,,,,,,,,,,,,,,,,
7480994593580813623,TIKTOK,2025-03-12 14:39:53,VIDEO,Timeline,big news just dropped at McD’s #McDonalds #McDs #McdonaldsCanada #Fyp #CinnamonSwirl ,https://www.tiktok.com/@mcdonaldscanada/video/7480994593580813623?utm_campaign=tt4d_open_api&utm_source=7055758955263295490,6513,5286,2.58%,50,29.76%,168,,,,,,,,,,,,,,,,,,,,
146775140426_1062385495919404,FACEBOOK,2025-03-12 11:01:21,IMAGE,Timeline,if u haven’t been cinnaswirled u haven’t experienced life,https://www.facebook.com/713040447520579/posts/1062385495919404,38713,36022,0.37%,9,6.29%,143,,,,,,,,,,,,,,,,,,,,
17941878380846755,INSTAGRAM,2025-03-12 10:58:44,IMAGE,Timeline,if u haven’t been cinnaswirled u haven’t experienced life,https://www.instagram.com/p/DHGp0PNudVY/,36388,22111,1.60%,150,25.73%,583,,,,,,,,,,,,,,,,,,,,
18033533492300228,INSTAGRAM,2025-03-11 13:59:47,CAROUSEL,Timeline,Envoie ça à l’ami avec qui tu voudrais essayer le nouveau Quart de livre sauce jalapeño au fromage avec bacon,https://www.instagram.com/p/DHEX2Knp9eP/,5391,2594,2.97%,50,31.25%,160,FR,,,,,,,,,,,,,,,Cheesy Jalapeno QP,,,,
7480612558613794103,TIKTOK,2025-03-11 13:57:24,VIDEO,Timeline,i can never get to the end of this video without ordering the Cheesy Jalapeño + Bacon Quarter Pounder (also congrats if u made it to the end of the sentence because it’s a mouthful) #McDonalds #McDs #McDonaldsCanada #Fyp #Food #Burger #Eats ,https://www.tiktok.com/@mcdonaldscanada/video/7480612558613794103?utm_campaign=tt4d_open_api&utm_source=7055758955263295490,8893,7337,1.87%,58,34.94%,166,,,,,,,,,,,,,,,,Cheesy Jalapeno QP,,,,
7480604898187414790,TIKTOK,2025-03-11 13:27:44,VIDEO,Timeline,Impossible de me rendre à la fin de cette vidéo sans commander le nouveau Quart de livre sauce jalapeño au fromage avec bacon #McDo #tiktokquebec #pourtoi #qc ,https://www.tiktok.com/@mcdocanada/video/7480604898187414790?utm_campaign=tt4d_open_api&utm_source=7055758955263295490,1656,1341,2.66%,3,6.82%,44,FR,,,,,,,,,,,,,,,Cheesy Jalapeno QP,,,,
146775140426_1061557909335496,FACEBOOK,2025-03-11 11:54:23,IMAGE,Timeline,Envoie ça à l’ami avec qui tu voudrais essayer le nouveau Quart de livre sauce jalapeño au fromage avec bacon.,https://www.facebook.com/713040447520579/posts/1061557909335496,33100,30955,0.39%,10,7.81%,128,FR,,,,,,,,,,,,,,,Cheesy Jalapeno QP,,,,
146775140426_1061532779338009,FACEBOOK,2025-03-11 11:13:30,IMAGE,Timeline,"and by a mouthful, i mean my mouth is full",https://www.facebook.com/713040447520579/posts/1061532779338009,36351,34147,0.46%,18,10.78%,167,,,,,,,,,,,,,,,,Cheesy Jalapeno QP,,,,
18061517234060692,INSTAGRAM,2025-03-11 11:06:13,CAROUSEL,Timeline,"and by a mouthful, i mean my mouth is full",https://www.instagram.com/p/DHED-89O-og/,51804,27601,2.14%,440,39.64%,1110,,,,,,,,,,,,,,,,Cheesy Jalapeno QP,,,,
7480244077376687415,TIKTOK,2025-03-10 14:07:34,VIDEO,Timeline,"final buzzer. just like the man himself, McDavid’s was legendary. thanks for pulling up, Canada. 🏒 #McDs #McDonalds #McDavid #Hockey #HockeyTok #ConnorMcDavid #Fyp ",https://www.tiktok.com/@mcdonaldscanada/video/7480244077376687415?utm_campaign=tt4d_open_api&utm_source=7055758955263295490,10651,8545,5.15%,41,7.48%,548,,,,,,,,,,,,,,,,,McDavid's,,,
18080936521723316,INSTAGRAM,2025-03-10 13:11:37,REELS,REELS,"final buzzer. just like @mcdavid97, McDavid’s was legendary. thanks for pulling up, Canada. 🏒",https://www.instagram.com/reel/DHBtVNUOw3e/,24336,16999,2.91%,43,6.06%,709,,,,,,,,,,,,,,,,,McDavid's,,,
146775140426_1058455912979029,FACEBOOK,2025-03-07 12:33:19,TEXT,Timeline,Vendredi soir = Soir de McLivraison Qui ici est d’accord?,https://www.facebook.com/713040447520579/posts/1058455912979029,19556,18794,0.15%,0,0.00%,30,FR,,,,,,,,,,,,,,,,,,,
18218143126295881,INSTAGRAM,2025-03-07 11:02:32,IMAGE,Timeline,clinomania: an excessive desire to stay in bed  McLinomania: an excessive desire to do the above AND get MMR points,https://www.instagram.com/p/DG53P20u4cc/,42164,26882,2.77%,261,22.31%,1170,,,,,,,,,,,,,,,,,,,,
7478775564174871863,TIKTOK,2025-03-06 14:08:53,VIDEO,Timeline,did i set this trap for myself? yes #McDs #McDonalds #Fyp #Trend #Relatable #McNuggets ,https://www.tiktok.com/@mcdonaldscanada/video/7478775564174871863?utm_campaign=tt4d_open_api&utm_source=7055758955263295490,63512,60334,1.11%,46,6.52%,706,,,,,,,,,,,,,,,,,,,,
7478753691688865029,TIKTOK,2025-03-06 12:44:01,VIDEO,Timeline,T’en croiras pas tes yeux… #McDo #tiktokquebec #pourtoi #qc ,https://www.tiktok.com/@mcdocanada/video/7478753691688865029?utm_campaign=tt4d_open_api&utm_source=7055758955263295490,1211,978,5.12%,13,20.97%,62,FR,,,,,,,,,,,,,,,,,,,
18299703913214037,INSTAGRAM,2025-03-06 12:30:11,CAROUSEL,Timeline,T’en croiras pas tes yeux…,https://www.instagram.com/p/DG3cfBHpY28/,10566,6600,2.55%,53,19.70%,269,FR,,,,,,,,,,,,,,,,,,,
146775140426_1057566826401271,FACEBOOK,2025-03-06 11:22:49,IMAGE,Timeline,employee of the month? nah. Canadian of the month. 🏒🇨🇦,https://www.facebook.com/713040447520579/posts/1057566826401271,35165,32250,0.92%,23,7.08%,325,,,,,,,,,,,,,,,,,McDavid's,,,
1897681233255039456,TWITTER,2025-03-06 11:10:37,IMAGE,Timeline,employee of the month? nah. @cmcdavid97 is Canadian of the month. 🏒🇨🇦 https://t.co/7avM3sdN9i,https://twitter.com/McDonaldsCanada/status/1897681233255039456,8847,-,1.16%,9,8.74%,103,,,,,,,,,,,,,,,,,McDavid's,,,
18058138259098998,INSTAGRAM,2025-03-06 11:09:23,IMAGE,Timeline,employee of the month? nah. @mcdavid97 is Canadian of the month. 🏒🇨🇦,https://www.instagram.com/p/DG3TPJ4vbFB/,28893,16929,2.75%,69,8.68%,795,,,,,,,,,,,,,,,,,McDavid's,,,
7478462779205094711,TIKTOK,2025-03-05 17:55:10,VIDEO,Timeline,Tout le monde parle du nouveau McÉpicé ! Profites-en maintenant. Il ne fait que passer. 👀 #McDo #tiktokquebec #pourtoi ,https://www.tiktok.com/@mcdocanada/video/7478462779205094711?utm_campaign=tt4d_open_api&utm_source=7055758955263295490,1093,904,3.93%,1,2.33%,43,FR,,,,,,,,,,,,,,,,,,,
17899637106116134,INSTAGRAM,2025-03-05 17:51:36,REELS,REELS,Tout le monde parle du nouveau McÉpicé ! Profites-en maintenant. Il ne fait que passer. 👀,https://www.instagram.com/reel/DG1cUV8sqKh/,5757,4569,2.08%,4,3.33%,120,FR,,,,,,,,,,,,,,,,,,,
7478402086523243782,TIKTOK,2025-03-05 13:59:41,VIDEO,Timeline,all praise to the mighty McDavid(’s) 🏒 #McDs #McDonalds #McDavid #Hockey #HockeyTok #connormcdavid #hockeyplayer #fyp ,https://www.tiktok.com/@mcdonaldscanada/video/7478402086523243782?utm_campaign=tt4d_open_api&utm_source=7055758955263295490,7656,6258,3.30%,21,8.30%,253,,,,,,,,,,,,,,,,,McDavid's,,,
18355148572178463,INSTAGRAM,2025-03-05 13:49:37,REELS,REELS,all praise to the mighty McDavid(’s) 🏒 @mcdavid97,https://www.instagram.com/reel/DG1At0VyB4x/,37463,28455,2.57%,225,23.34%,964,,,,,,,,,,,,,,,,,McDavid's,,,
146775140426_1056778889813398,FACEBOOK,2025-03-05 11:21:16,IMAGE,Timeline,try the new McSpicy before it’s gone.,https://www.facebook.com/713040447520579/posts/1056778889813398,20950,20880,0.38%,6,7.50%,80,,,,,,,,,,,,,,,,,,,,
18269784832267049,INSTAGRAM,2025-03-05 11:06:23,IMAGE,Timeline,try the new McSpicy before it’s gone.,https://www.instagram.com/p/DG0uGXbpgoB/,29649,17648,1.09%,37,11.49%,322,,,,,,,,,,,,,,,,,,,,
7476965254665080070,TIKTOK,2025-03-01 17:03:59,VIDEO,Timeline,for the game. for the fans. for McDavid. welcome to McDavid’s. 🏒 #McDavid #connormcdavid #McD #McDonalds #hockey #hockeytok #fyp ,https://www.tiktok.com/@mcdonaldscanada/video/7476965254665080070?utm_campaign=tt4d_open_api&utm_source=7055758955263295490,9948,8297,2.33%,22,9.48%,232,,,,,,,,,,,,,,,,,McDavid's,,,
17918877195063967,INSTAGRAM,2025-03-01 17:00:56,REELS,REELS,for the game. for the fans. for @mcdavid97. welcome to McDavid’s. 🏒,https://www.instagram.com/reel/DGrDd8mS2ny/,34117,23917,2.56%,139,15.94%,872,,,,,,,,,,,,,,,,,McDavid's,,,
17930344413007689,INSTAGRAM,2025-02-28 15:37:41,CAROUSEL,Timeline,a promise is a promise. McDavid’s is officially a thing. 🏒  @mcdavid97   Newmarket: 1100 Davis Dr Edmonton: 10375-51st Avenue,https://www.instagram.com/p/DGoVK_7y5iu/,75843,38283,4.04%,915,29.86%,3064,,,,,,,,,,,,,,,,,McDavid's,,,
1895572558633898340,TWITTER,2025-02-28 15:31:30,IMAGE,Timeline,pardon our language but…puck yeah. @cmcdavid97 https://t.co/kofAQ6Emp7,https://twitter.com/McDonaldsCanada/status/1895572558633898340,335414,-,1.63%,468,8.58%,5454,,,,,,,,,,,,,,,,,McDavid's,,,
146775140426_1052955350195752,FACEBOOK,2025-02-28 15:18:35,IMAGE,Timeline,"Les restaurants McDavid’s sont officiellement ouverts à Newmarket, ville natale de Connor McDavid, et à Edmonton! Qui est partant pour un road trip?",https://www.facebook.com/713040447520579/posts/1052955350195752,117537,114108,0.31%,38,10.30%,369,FR,,,,,,,,,,,,,,,,McDavid's,,,
18034868306571003,INSTAGRAM,2025-02-28 15:15:33,IMAGE,Timeline,"Les restaurants McDavid’s sont officiellement ouverts à Newmarket, ville natale de @mcdavid97, et à Edmonton! Qui est partant pour un road trip?",https://www.instagram.com/p/DGoSo8CBL1X/,11866,8751,3.94%,68,14.56%,467,FR,,,,,,,,,,,,,,,,McDavid's,,,
7476496564299550007,TIKTOK,2025-02-28 10:45:14,VIDEO,Timeline,"McDavid’s is real, it exists, and yeah, u should be here. only in Edmonton, AB (10375-51st Avenue) & Newmarket, ON (1100 Davis Drive).  #mcds #mcdonalds #canada #mcdonaldscanada #mcdavid #connormcdavid #hockey #hockeytok #hockeylife #hockeyplayer #hockeyedit #fyp ",https://www.tiktok.com/@mcdonaldscanada/video/7476496564299550007?utm_campaign=tt4d_open_api&utm_source=7055758955263295490,67024,54601,8.33%,635,11.38%,5582,,,,,,,,,,,,,,,,,McDavid's,,,
17908746113999584,INSTAGRAM,2025-02-28 10:37:15,REELS,REELS,"McDavid’s is real, it exists, and yeah, u should be here. only in Edmonton, AB (10375-51st Avenue) & Newmarket, ON (1100 Davis Drive) @mcdavid97",https://www.instagram.com/reel/DGnyqpuun-A/,197256,112889,4.92%,4160,42.87%,9703,,,,,,,,,,,,,,,,,McDavid's,,,
7476139190636268806,TIKTOK,2025-02-27 11:38:24,VIDEO,Timeline,POV: just woke up with a McNugget craving #McDs #McDonalds #Fyp #Trend ,https://www.tiktok.com/@mcdonaldscanada/video/7476139190636268806?utm_campaign=tt4d_open_api&utm_source=7055758955263295490,6247,5169,3.09%,16,8.29%,193,,,,,,,,,,,,,,,,,,,,
7475817647108525317,TIKTOK,2025-02-26 14:50:39,VIDEO,Timeline,POV : moi je me suis réveillé en ayant le goût de manger des McCroquettes #McDo #tiktokquebec #pourtoi #pov ,https://www.tiktok.com/@mcdocanada/video/7475817647108525317?utm_campaign=tt4d_open_api&utm_source=7055758955263295490,5165,4426,4.67%,11,4.56%,241,FR,,,,,,,,,,,,,,,,,,,
7475793376718163205,TIKTOK,2025-02-26 13:16:31,VIDEO,Timeline,"that’ll be a firm and friendly “no ❤️” from me, thank u #McDs #McDonalds #Fyp #Trend ",https://www.tiktok.com/@mcdonaldscanada/video/7475793376718163205?utm_campaign=tt4d_open_api&utm_source=7055758955263295490,4782,4084,2.80%,9,6.72%,134,,,,,,,,,,,,,,,,,,,,
18040312391525827,INSTAGRAM,2025-02-26 11:58:47,REELS,REELS,"Si tu te demandes si mon but était de faire paniquer la personne avec qui tu partages ça, la réponse est oui.",https://www.instagram.com/reel/DGiycM2SJjv/,2246047,1632361,2.69%,5604,9.26%,60509,FR,,,,,,,,,,,,,,,,,,,
1894794191227531399,TWITTER,2025-02-26 11:58:33,LINK,Timeline,"ok i ran out of space, but here are some of the prizes u could win* (it ends soon, so go, go, go!) https://t.co/P2PFZgCL0q",https://twitter.com/McDonaldsCanada/status/1894794191227531399,13341,-,0.19%,1,3.85%,26,,,,,,,,,,,,,,,,,,,,
1894794053289464280,TWITTER,2025-02-26 11:58:00,TEXT,Timeline,"this is a PSA to let u know that if u play Want Prize With That? before it’s gone u could wiiiiiiin* a... Cash Prize^, $50 Walmart Gift Card, MyMcDonald’s Rewards points, $25 Skip Gift Card, Journey for 2 with VIA Rail, One Year Subscription to Paramount+, Big Mac, Double Cheese",https://twitter.com/McDonaldsCanada/status/1894794053289464280,17679,-,0.15%,2,7.41%,27,,,,,,,,,,,,,,,,,,,,
17892992238179473,INSTAGRAM,2025-02-26 11:10:37,REELS,REELS,"it turns out i DO make the rules, and my rule is making whoever u share this with panic",https://www.instagram.com/reel/DGis4lZuJz-/,71931,51258,3.61%,1332,51.25%,2599,,,,,,,,,,,,,,,,,,,,
7475403825654893879,TIKTOK,2025-02-25 12:04:48,VIDEO,Timeline,that new Cinnamon Swirl and $1 +tax small Premium Roast Coffee is out of this world… like i actually need a moment after every bite #McDs #McDonalds #McDonaldsCanada #Fyp ,https://www.tiktok.com/@mcdonaldscanada/video/7475403825654893879?utm_campaign=tt4d_open_api&utm_source=7055758955263295490,5818,4790,1.72%,13,13.00%,100,,,,,,,,,,,,,,,,,,,,
7475386870306770182,TIKTOK,2025-02-25 10:59:02,VIDEO,Timeline,Qui d’autre trouve que le petit café infusé à 1 $ + taxes et la Brioche à la cannelle est un duo tombé du ciel? #McDo #tiktokquebec #pourtoi ,https://www.tiktok.com/@mcdocanada/video/7475386870306770182?utm_campaign=tt4d_open_api&utm_source=7055758955263295490,1747,1464,2.98%,2,3.85%,52,FR,,,,,,,,,,,,,,,,,,,
18084137644611330,INSTAGRAM,2025-02-25 10:43:18,CAROUSEL,Timeline,Ça doit être étourdissant d'être une Brioche à la cannelle.,https://www.instagram.com/p/DGgFGMKAckU/,5402,2967,2.52%,11,8.09%,136,FR,,,,,,,,,,,,,,,,,,,
18156289201355656,INSTAGRAM,2025-02-25 10:40:52,CAROUSEL,Timeline,a completely factual representation of how every moment with the new Cinnamon Swirl starts,https://www.instagram.com/p/DGgE0Z5OV-F/,37560,18112,2.20%,154,18.60%,828,,,,,,,,,,,,,,,,,,,,
7475083936339742007,TIKTOK,2025-02-24 15:23:32,VIDEO,Timeline,"Si tu te demandes si mon but était de faire paniquer la personne avec tu partages ça, la réponse est oui. #McDo #tiktokquebec #pourtoi ",https://www.tiktok.com/@mcdocanada/video/7475083936339742007?utm_campaign=tt4d_open_api&utm_source=7055758955263295490,176167,154530,12.38%,9086,41.64%,21818,FR,,,,,,,,,,,,,,,,,,,
17933103164990995,INSTAGRAM,2025-02-24 15:13:54,IMAGE,Timeline,Je pourrais lancer un balado au complet juste pour parler de mon amour pour cette poutine 😍,https://www.instagram.com/p/DGd_RRJBRXN/,6200,4848,2.63%,33,20.25%,163,FR,,,,,,,,,,,,,,,,,,,
1893798688918487411,TWITTER,2025-02-23 18:02:47,LINK,Timeline,"still can't stop thinking about that shot @cmcdavid97.   golden goal 🤝 golden arches.   see you all at McDavid’s in Edmonton, AB and in Newmarket, ON in honour of our hometown hero - opening this week!!! 🥇🐐🏒🇨🇦 https://t.co/NYIr0JdpH1",https://twitter.com/McDonaldsCanada/status/1893798688918487411,46575,-,0.78%,31,8.49%,365,,,,,,,,,,,,,,,,,McDavid's,,,
146775140426_1047361284088492,FACEBOOK,2025-02-21 14:01:46,IMAGE,Timeline,Je vais te prendre une Coupe de la victoire avec ça 🏆🙌,https://www.facebook.com/713040447520579/posts/1047361284088492,47376,46204,0.56%,8,3.01%,266,FR,,,,,,,,,,,,,,,,McDavid's,,,
18076611751660247,INSTAGRAM,2025-02-21 14:00:15,IMAGE,Timeline,Je vais te prendre une Coupe de la victoire avec ça 🏆🙌,https://www.instagram.com/p/DGWIdSCJt7g/,5515,4061,3.14%,34,19.65%,173,FR,,,,,,,,,,,,,,,,McDavid's,,,
146775140426_1047351537422800,FACEBOOK,2025-02-21 13:40:14,IMAGE,Timeline,trying to play it cool but feeling VERY EXCITED about my order today,https://www.facebook.com/713040447520579/posts/1047351537422800,70739,67754,0.80%,27,4.79%,564,,,,,,,,,,,,,,,,,McDavid's,,,
18011537027700909,INSTAGRAM,2025-02-21 13:11:37,IMAGE,Timeline,trying to play it cool but feeling VERY EXCITED about my order today,https://www.instagram.com/p/DGWC5EBv57k/,55121,38001,4.13%,188,8.26%,2277,,,,,,,,,,,,,,,,,McDavid's,,,
